<?xml version="1.0" encoding="utf-8"?>

<jeu xmlns="http://www.tp1.fr/game" 
     xsi:schemaLocation="http://www.tp1.fr/game.xsd" 
     xmlns:xsi="http://www.w3.org/2001/XMLSchema-instance">
    <perso>
        <nom>Malleron</nom>
    </perso>
    <classe>
        <temps />
        <ranges>
            <tables>1</tables>
            <tables>0</tables>
        </ranges>
        <ranges>
            <tables>1</tables>
            <tables>1</tables>
        </ranges>
        <ranges>
            <tables>0</tables>
            <tables>0</tables>
        </ranges>
    </classe>
    <classe>
        <temps />
        <ranges>
            <tables>0</tables>
            <tables>1</tables>
        </ranges>
    </classe>
    <classe>
        <temps />
        <ranges>
            <tables>2</tables>
            <tables>0</tables>
        </ranges>
        <ranges>
            <tables>1</tables>
            <tables>0</tables>
        </ranges>
        <ranges>
            <tables>0</tables>
            <tables>1</tables>
        </ranges>
    </classe>
</jeu>

